{"type":"vm-disk-chain/v1","driver":"qemu","guest_os":"linux","arch":"arm64","layers":[{"role":"disk","name":"alpine_3_21.qcow2","format":"qcow2","path":"/Users/jeff/Library/Caches/warden/images/alpine_3_21.qcow2","sha256":"ebaef97d702d123dd0a0cf4baf878d27ce02074529fcf01e5aa87bd866ba2848","size":207093760,"source":{"kind":"local"}}],"seed":[{"name":"build-script","sha256":"357f13d7efa03450b999e0d147bae8dcec0b328d74bcdefa48178c9d7b321441","size":82},{"name":"meta-data","sha256":"f1404df16bc8e80ce0e6932892f90c2b7b43f4050a97c740bde31ab3551a86d5","size":48},{"name":"network-config","sha256":"582bb0669a5dc46f684cff611ba51a2085664bf990a9c424501d9841f0b9ed3e","size":169},{"name":"user-data","sha256":"df9078bde64795c28a1bb851083b446524f4b540e1e2c2a4188bae43c7a0f910","size":289},{"name":"warden-io","sha256":"b8c357db4317701dad0443dfd5a5c44db5b085360bc51fb215a18d5b6487305a","size":8607795}]}