{"type":"vm-disk-chain/v1","driver":"qemu","guest_os":"windows","arch":"arm64","layers":[{"role":"disk","name":"windows-arm64.qcow2","format":"qcow2","path":"/Users/jeff/Library/Caches/warden/images/windows-arm64.qcow2","sha256":"bc917e5249d4aba06ac3b8c201423792df99631b935ac7ac62853428a45c44f5","size":12796100608,"source":{"kind":"prepared","prepared_by":"warden dev","inputs":[{"name":"install-iso","sha256":"638aa2c88e94385b00f4f178d071e3df0b7d9e335577a83bd533b7f2eb65adf0"},{"name":"virtio-win-iso","sha256":"303f7ae40dad495d6ae474fdc571df58958a4dbc5c37a522d80f9a203867949d"},{"name":"autounattend-iso","sha256":"8ae8f5774f419456e91045f7b14a64795efa653ad7d2ee5bbb9230f8b39d5854"}]}},{"role":"nvram","name":"windows-arm64-vars.fd","format":"raw","path":"/Users/jeff/Library/Caches/warden/images/windows-arm64-vars.fd","sha256":"7a8a7e7ea63f5c96600c521e59bd2d9a13775389e44fd10c30a36e80a1cc1776","size":67108864,"source":{"kind":"prepared","prepared_by":"warden dev","inputs":[{"name":"install-iso","sha256":"638aa2c88e94385b00f4f178d071e3df0b7d9e335577a83bd533b7f2eb65adf0"},{"name":"virtio-win-iso","sha256":"303f7ae40dad495d6ae474fdc571df58958a4dbc5c37a522d80f9a203867949d"},{"name":"autounattend-iso","sha256":"8ae8f5774f419456e91045f7b14a64795efa653ad7d2ee5bbb9230f8b39d5854"}]}}],"seed":[{"name":"build-script","sha256":"f087b7a6899e9275800e23d5104cdab9d50713d29962c2c6e49bd2702e37212c","size":196},{"name":"warden-io.exe","sha256":"101c52574cc9d7f192ad7f3721fe89504cd9be8b6269106f2d116ace54b41040","size":5930496},{"name":"warden-run.ps1","sha256":"7007eb132fde3827930005b8ff8fce36d49649449d779eec06453e1cc589c4b4","size":1065}]}