{"type":"vm-disk-chain/v1","driver":"qemu","guest_os":"windows","arch":"arm64","layers":[{"role":"disk","name":"windows-arm64.qcow2","format":"qcow2","path":"/Users/jeff/Library/Caches/warden/images/windows-arm64.qcow2","sha256":"bc917e5249d4aba06ac3b8c201423792df99631b935ac7ac62853428a45c44f5","size":12796100608,"source":{"kind":"prepared","prepared_by":"warden dev","inputs":[{"name":"install-iso","sha256":"638aa2c88e94385b00f4f178d071e3df0b7d9e335577a83bd533b7f2eb65adf0"},{"name":"virtio-win-iso","sha256":"303f7ae40dad495d6ae474fdc571df58958a4dbc5c37a522d80f9a203867949d"},{"name":"autounattend-iso","sha256":"8ae8f5774f419456e91045f7b14a64795efa653ad7d2ee5bbb9230f8b39d5854"}]}},{"role":"disk","name":"windows-arm64-20261031T185222Z.qcow2","format":"qcow2","path":"/Users/jeff/Library/Caches/warden/images/prepared/windows-arm64-20261031T185222Z.qcow2","sha256":"54a4c536581faabbf9f70c3face8964994467dd42d55961d2fa459d7a96e8e5c","size":1563688960,"source":{"kind":"prepared","prepared_by":"warden dev","inputs":[{"name":"Autounattend.xml","sha256":"c5003393a8eab7e67f4a2f05535f0432bbc754073c4f957ecdff8a9aed9a5db8","size":2219},{"name":"unattend.xml","sha256":"c5003393a8eab7e67f4a2f05535f0432bbc754073c4f957ecdff8a9aed9a5db8","size":2219},{"name":"warden-prepare.ps1","sha256":"ea78903ba1e61c52eaab7c5935eec9b45d7f85a319aa4cf96b207dd3a3992536","size":7294}]}},{"role":"nvram","name":"windows-arm64-20261031T185222Z-vars.fd","format":"raw","path":"/Users/jeff/Library/Caches/warden/images/prepared/windows-arm64-20261031T185222Z-vars.fd","sha256":"8f74e5e452b8340eb3db0e6f92f302ef4df71612a07389b3090da6dc3a0d14a4","size":67108864,"source":{"kind":"local"}}],"seed":[{"name":"build-script","sha256":"b3d46836cad1ad4bd3ccb390f795d29538b3e61504b9b09366cec2b1412d3ba9","size":294},{"name":"warden-io.exe","sha256":"1224a8ff3aa483b0a1b777a76915d39aee894a60af7cf552005fa52a5eac8b6d","size":5930496},{"name":"warden-run.ps1","sha256":"7007eb132fde3827930005b8ff8fce36d49649449d779eec06453e1cc589c4b4","size":1065}]}